{"schema_version":"1.0","analysis_run_id":"0198fd40-1111-7000-8000-000000000004","platform":"android","sample_sha256":"aaaaaaaaaaaaaaaaaaaaaaaaaaaaaaaaaaaaaaaaaaaaaaaaaaaaaaaaaaaaaaaa","pcap":{"artifact_id":"0198fd40-1111-7000-8000-000000000005","sha256":"bbbbbbbbbbbbbbbbbbbbbbbbbbbbbbbbbbbbbbbbbbbbbbbbbbbbbbbbbbbbbbbb"},"analysis_window":{"started_at":"2026-08-08T12:00:00Z","ended_at":"2026-08-08T12:05:00Z"},"guest_ip":"10.0.0.2","access_events":{"artifact_id":null,"source":"unavailable","correlation_eligible":false},"static_prior":{"artifact_id":null},"platform_manifest":{"artifact_id":"0198fd40-1111-7000-8000-000000000006","sha256":"cccccccccccccccccccccccccccccccccccccccccccccccccccccccccccccccc"}}
